{
  "$schema": "owner-decision.schema.json",
  "schema_id": "codex.ui-owner-decision/v1",
  "generated_by": {
    "script": "assemble_owner_decision.py",
    "version": "1.0.0",
    "command": "assemble_owner_decision.py <paths-redacted>"
  },
  "program_id": "CUSTOMETRY-UI-DESIGN-PROGRAM-V2",
  "decision_id": "G4@family.auth.shell-auth.baseline-exception-auth-r5.bounded-correction-03",
  "decision_kind": "family_acceptance",
  "target": {
    "artifact_kind": "review_board",
    "artifact_id": "family.auth.shell-auth.baseline-exception-auth-r5",
    "revision": 5,
    "validation_profile": "family_review_ready",
    "path": ".codex/delivery/ui-design-programs/custometry-v2/artifacts/g4-r5/family-auth-shell-auth-baseline-exception-auth/review-board.html",
    "sha256": "167a65673b8cc06130cf65bb8311ae72abd9e00e3ade74759d3e21e66355d8a1"
  },
  "decision": {
    "status": "requested_changes",
    "revision": 5,
    "decision_text": "Keep each sign-in and recovery window at the exact geometry of its initial state across loading, validation, failure, session-expired, and interactive feedback states, without enlarging either initial composition.",
    "accepted_values": [],
    "accepted_value_sha256s": []
  },
  "recording": {
    "source": "natural_language_owner_input",
    "owner_input": "В целом хорошо, но один момент который надо пофиксить — недопустимы разные размеры окна входа и восстановления в зависимости от этапа (начало/загрузка и все остальное). Окно всегда одного размера должно оставаться, не изменяя изначальный размер экрана с этапа «Начало».",
    "recorded_by": "agent",
    "recorded_at": "2026-08-14T07:34:31.810877+00:00"
  }
}
